<?xml version="1.0" encoding="UTF-8"?>
<!DOCTYPE alumnos SYSTEM "alumnos.dtd">

<alumnos>
    <!-- Alumno 1: Es de origen español, tiene altura, sexo y sirve de ayuda (ID: A101) -->
    <alumno num_alumno="A101" altura="175" sexo="hombre">
        <nombre>Carlos</nombre>
        <apellidos>García Pérez</apellidos>
        <domicilio>Calle Mayor 14, 2ºB</domicilio>
        <telefono tipo="propio">600123456</telefono>
        <telefono tipo="padre">600987654</telefono>
        <equipo>Baloncesto</equipo>
        <aficion>Fotografía</aficion>
        <aficion>Senderismo</aficion>
        <provincia>Sevilla</provincia>
        <comentarios>Alumno excelente, delegado de clase con <nombre>Carlos</nombre> asignado.</comentarios>
        <evaluacion>Primera Evaluación</evaluacion>
        <calificacion>8.5</calificacion>
        <evaluacion>Segunda Evaluación</evaluacion>
        <calificacion>9.0</calificacion>
    </alumno>

    <!-- Alumno 2: Es extranjero, no define altura ni sexo, y es ayudado por el Alumno 1 (IDREF: A101) -->
    <alumno num_alumno="A102" ayudado_por="A101">
        <nombre>Elena</nombre>
        <apellidos>Smirnova</apellidos>
        <domicilio>Avenida de la Constitución 45</domicilio>
        <telefono tipo="tutor">611223344</telefono>
        <!-- No tiene equipo ni aficiones (son opcionales) -->
        <pais>Ucrania</pais>
        <evaluacion>Primera Evaluación</evaluacion>
        <calificacion>7.0</calificacion>
    </alumno>
</alumnos>